,subreddit,body,controversiality,score
0,gameofthrones,"Your submission has been automatically removed because all post titles must begin with one hard-bracketed spoiler scope tag, like [SPOILERS] or [NO SPOILERS]. Please review the options posted in the [spoiler guide](/r/gameofthrones/w/spoiler_guide) to find the title scope most appropriate for your post and [resubmit your content](/r/gameofthrones/submit).

*I am a bot, and this action was performed automatically. Please [contact the moderators of this subreddit](/message/compose/?to=/r/gameofthrones) if you have any questions or concerns.*",0,1
1,aww,"Dont squeeze her with you massive hand, you mean giant.",0,19
2,gaming,It's pretty well known and it was a paid product placement. Hamilton advertised the watch around the movie and had an Interstellar page on their website. The biggest product placement was the Carhartt jacket though.   Brands send old merch all the time by the way for movies. Just watch Stranger Things for tons of examples of that. Eggos are prominently featured as Eleven's favorite food.,0,3
3,news,You know we have laws against that currently correct? Or are you just willfully ignorant of gun laws in the US.,0,10
4,politics,"Yes, there is a difference between gentle suppression and hard suppression.  Neither are good things.",0,1
5,dankmemes,Please let this become a meme. I want some Dark Pheniox memes,0,2
6,relationship_advice,I would be less worried about how he fucked up in the past and more worried that I still can't get a straight answer about it now.,0,7
7,nba,REPORT: Water is wet.,0,9
8,worldnews,How many millions have to suffer and die for them to feel any of that pain though?,0,3
9,aww,What an amazing tradition!!! So special!!!,0,3
